<?xml version="1.0" encoding="UTF-8" standalone="no"?>
<jornada xmlns:xsi="http://www.w3.org/2001/XMLSchema-instance"
    xsi:noNamespaceSchemaLocation="Ejercicio10.xsd">
    <equipos>
        <equipo>
            <nombre></nombre>
            <entrenador></entrenador>
            <localidad></localidad>
            <posicion>3</posicion>
            <partidos>
                <jugados>4</jugados>
                <perdidos>5</perdidos>
                <empatados>1</empatados>
            </partidos>
            <golaveraje>
                <favor>0</favor>
                <contra>1</contra>
            </golaveraje>
        </equipo>
    </equipos>
    <partidosJornada>
        <partido>
            <local></local>
            <visitante></visitante>
            <golesLocal></golesLocal>
            <golesVisitante></golesVisitante>
        </partido>
    </partidosJornada>
</jornada>